{
  "$schema": "http://json-schema.org/draft-07/schema#",
  "$id": "https://databricks-solutions.github.io/consort/schemas/ac.schema.json",
  "title": "AcceptanceCriterion",
  "description": "One observable behavior. Tagged API / E2E / Infra. Maps to one or more scenarios in the test list.",
  "type": "object",
  "required": ["id", "given", "when", "then", "status"],
  "properties": {
    "id": {
      "type": "string",
      "pattern": "^AC[0-9]+(-[a-z0-9-]+)?$"
    },
    "layer": {
      "type": "string",
      "enum": ["API", "E2E", "Infra"],
      "description": "Which layer the AC exercises. Assigned by the Architect Reviewer in phase 7.1 (NOT written by the spec-author, so it is optional at spec time; the architect self-check and the design gate require it once the architect has run)."
    },
    "given": {
      "type": "string",
      "description": "Precondition (Gherkin Given)."
    },
    "when": {
      "type": "string",
      "description": "Action (Gherkin When)."
    },
    "then": {
      "type": "string",
      "description": "Expected outcome (Gherkin Then)."
    },
    "scenarios": {
      "type": "array",
      "items": { "type": "string" },
      "description": "Scenario filenames or IDs that exercise this AC."
    },
    "nfrs": {
      "type": "array",
      "items": {
        "type": "object",
        "required": ["category", "requirement"],
        "properties": {
          "category": {
            "type": "string",
            "enum": ["performance", "scalability", "security", "observability", "operability", "resilience"]
          },
          "requirement": { "type": "string" },
          "notes": { "type": "string" }
        }
      }
    },
    "architectural_notes": {
      "type": "string",
      "description": "Layer assignment rationale, cross-cutting concerns touched, owner module."
    },
    "status": {
      "type": "string",
      "enum": ["draft", "approved", "in-progress", "passing", "deprecated"]
    },
    "story_id": {
      "type": "string",
      "pattern": "^S[0-9]+(-[a-z0-9-]+)?$"
    },
    "independence": {
      "type": "object",
      "description": "Determination that this AC's `then` is NOT already delivered, implied, or duplicated by an earlier AC in the same story (the AC-independence test). Required for every AC after the first in a story (the spec gate hard-blocks a later AC that omits it or sets distinct_from_prior:false); the first AC has no prior and may omit it.",
      "required": ["distinct_from_prior", "rationale"],
      "additionalProperties": false,
      "properties": {
        "distinct_from_prior": {
          "type": "boolean",
          "description": "True iff this AC can go RED while every earlier AC in the story is GREEN (and vice versa). False means its outcome is already produced by an earlier AC's build and must be folded or re-scoped."
        },
        "rationale": {
          "type": "string",
          "minLength": 1,
          "description": "One line: the distinct, independently-RED-able outcome this AC adds beyond the earlier ACs."
        }
      }
    },
    "external_ref": {
      "type": "object",
      "properties": {
        "adapter": { "type": "string" },
        "external_id": { "type": "string" }
      }
    }
  },
  "additionalProperties": false
}
