{
  "id": "AC2-record-carries-inventory-code",
  "given": "a stock record filed with a single combined inventory tracking code (encoding location, batch, and serial together)",
  "when": "that stock record is retrieved",
  "then": "the record includes the combined inventory code exactly as it was filed",
  "status": "draft",
  "independence": {
    "distinct_from_prior": true,
    "rationale": "Adds persistence and read-back of the combined inventory_code, which is separate data from the SKU/location/quantity of AC1: the code can be dropped or corrupted while quantity persists correctly, and vice versa."
  }
}
