{
  "id": "AC4-combined-code-no-longer-displayed",
  "given": "the schema no longer carries the combined inventory_code and the split batch and serial fields are shown",
  "when": "an operator views the stock detail or list view",
  "then": "the combined tracking code is no longer displayed anywhere the split batch and serial fields now appear",
  "status": "draft",
  "independence": {
    "distinct_from_prior": true,
    "rationale": "Distinct from AC1/AC2, which assert the split fields are present: this asserts the obsolete combined code is absent from the UI. Both surfaces could show batch and serial correctly while still also rendering the old combined code (fails this, passes AC1/AC2), or hide the combined code while failing to render the split fields (fails AC1/AC2, passes this), so it is separately breakable."
  }
}
