{
  "id": "AC1-lists-stock-across-locations",
  "given": "a SKU that holds stock at more than one location",
  "when": "the warehouse team member opens that SKU's detail view",
  "then": "the view lists one row per location where that SKU holds stock, each showing the location and quantity",
  "status": "draft",
  "layer": "E2E"
}
