{
  "id": "AC2-nonconforming-code-left-null",
  "status": "draft",
  "layer": "Infra",
  "given": "a sprint-1 stock row whose inventory_code has no batch or serial segment (for example \"X-1\" or a bare \"c\")",
  "when": "the up migration runs and backfills the new columns",
  "then": "that row's batch_number and serial_number are left NULL rather than guessed or defaulted, and the row still survives the migration and is retrievable",
  "independence": {
    "distinct_from_prior": true,
    "rationale": "AC1 asserts a conforming code parses into populated batch/serial; AC2 asserts the opposite branch, a code that does not parse, is left NULL and not dropped. Backfill logic that parses conforming codes could still incorrectly guess or discard nonconforming ones, so this fails independently."
  }
}
