{
  "id": "AC2-filed-record-retrievable",
  "given": "a stock record has previously been filed for a (sku, location) pair",
  "when": "that record is retrieved later",
  "then": "it is read back showing the same stored SKU, location, quantity, and tracking code that were filed",
  "status": "draft",
  "independence": {
    "distinct_from_prior": true,
    "rationale": "AC1 observes the post-save confirmation echo; this AC observes durable persistence via a later read-back, which can break (record not actually stored) while the confirmation still renders, and vice versa."
  },
  "layer": "E2E"
}
