{
  "id": "AC3-refile-same-pair-updates-in-place",
  "given": "a stock record already exists for a given SKU at a given location",
  "when": "a warehouse operator files the same SKU at the same location again with a different quantity",
  "then": "the existing record is updated in place with the new quantity, exactly one record for that (SKU, location) pair exists, no duplicate record is created, and no error page is shown",
  "status": "draft",
  "independence": {
    "distinct_from_prior": true,
    "rationale": "Covers the write-collision path on the (SKU, location) key, an outcome independently breakable from the first-write of AC1: a build could persist a first record correctly yet store a duplicate (or error) on a repeat file for the same pair."
  },
  "layer": "API"
}
